{
  "$id": "https://raw.githubusercontent.com/solargis/schemas/v1.1.10/solargis_public_TS_API_request.schema.json",
  "$schema": "http://json-schema.org/draft-07/schema",

  "description": "Schema for Solargis data request - for getting timeseries datasets via API.",
  "type": "object",
  "required": [
    "site",
    "timeStep",
    "fromDate",
    "toDate",
    "columns",
    "outputFormat"
  ],
  "additionalProperties": true,
  "properties": {
    "site": {
      "description": "Site location definition.",
      "$ref": "solargis_data_request.schema.json#/$defs/DataRequest/properties/site",
      "examples": [
        {
          "latitude": 43.913961,
          "longitude": 142.419596,
          "elevation": 179,
          "name": "Pippu 比布町, Kamikawa District, Japan"
        }
      ]
    },
    "timeStep": {
      "type": "string",
      "enum": [
        "PT1M",
        "PT5M",
        "PT10M",
        "PT15M",
        "PT30M",
        "PT60M",
        "P1D",
        "P1M",
        "P1Y"
      ]
    },
    "fromDate": {
      "description": "Start date of the requested data. Inclusive. See also the utcOffset.",
      "$ref": "solargis_data_request.schema.json#/$defs/DataRequest/properties/fromDate"
    },
    "toDate": {
      "description": "End date of the requested data. Inclusive.",
      "$ref": "solargis_data_request.schema.json#/$defs/DataRequest/properties/toDate"
    },
    "columns": {
      "description": "Any valid column name is possible, but success output is generated only if name is allowed in the API subscription.",
      "$ref": "solargis_data_request.schema.json#/$defs/DataRequest/properties/columns"
    },
    "utcOffset": {
      "$ref": "solargis_data_request.schema.json#/$defs/DataRequest/properties/utcOffset"
    },
    "timeAlignment": {
      "$ref": "solargis_data_request.schema.json#/$defs/DataRequest/properties/timeAlignment"
    },
    "terrainShading": {
      "$ref": "solargis_data_request.schema.json#/$defs/DataRequest/properties/terrainShading"
    },
    "environment": {
      "$ref": "solargis_data_request.schema.json#/$defs/DataRequest/properties/environment"
    },
    "gtiConfiguration": {
      "description": "If pvConfiguration is included in the request, the API will use the gtiConfiguration object inside the pvConfiguration.",
      "$ref": "solargis_data_request.schema.json#/$defs/DataRequest/properties/gtiConfiguration"
    },
    "fileLabel": {
      "description": "The value will be used in the generated file name for output dataset.",
      "$ref": "solargis_common_types.schema.json#/$defs/FileLabel"
    },
    "outputFormat": {
       "$ref": "solargis_data_request.schema.json#/$defs/DataRequest/properties/outputFormat"
    },
    "outputRoundingLevel": {
      "$ref": "solargis_data_request.schema.json#/$defs/DataRequest/properties/outputRoundingLevel"
    },
    "compressOutput": {
      "$ref": "solargis_public_TS_request.schema.json#/properties/compressOutput"
    },
    "splitOutputByYears":{
      "$ref": "solargis_public_TS_request.schema.json#/properties/splitOutputByYears"
    },
    "pvConfiguration": {
      "description": "Object is required if at least one PV output related column is present in the array of requested columns (PVOUT*, TMOD).",
      "$ref": "solargis_data_request.schema.json#/$defs/DataRequest/properties/pvConfiguration"
    }
  },
  "$comment": "The mounting of the PV system is a part of pvConfiguration, so a separate gtiConfiguration would be ambiguous. Same rule as in solargis_data_request.schema.json.",
  "if": {
    "required": [
      "pvConfiguration"
    ]
  },
  "then": {
    "not": {
      "required": [
        "gtiConfiguration"
      ]
    }
  }
}