{
  "site": {
    "latitude": 43.023903,
    "longitude": 142.419596
  },
  "timeStep": "PT15M",
  "columns": [
    "GTI",
    "PVOUT"
  ],
  "fromDate": "2025-01-01",
  "toDate": "2025-01-01",
  "terrainShading": true,
  "timeAlignment": "START",
  "utcOffset": "+09:00",
  "outputFormat": "SOLARGIS_JSON",
  "pvConfiguration": {
    "simulationEngine": "v1.0",
    "segments": [
      {
        "installationType": "ROOF_MOUNTED",
        "installedPower": 2,
        "startupDate": "2020-01-01",
        "gtiConfiguration": {
          "layout": {
            "azimuth": 90,
            "mounting": {
              "type": "FIXED_ONE_ANGLE",
              "tilt": 39
            }
          }
        },
        "degradation": 0.5,
        "degradationFirstYear": 0.8,
        "module": {
          "technology": "CSI"
        },
        "inverter": {
          "inverterLimitationACPower": 5,
          "startPower": 0.02,
          "inverterEfficiency": {
            "constant": 97.5
          }
        },
        "dcLosses": {
          "overall": 5.4
        },
        "acLosses": {
          "overall": 1.5
        }
      },
      {
        "installationType": "ROOF_MOUNTED",
        "installedPower": 2,
        "startupDate": "2020-01-01",
        "gtiConfiguration": {
          "layout": {
            "azimuth": 270,
            "mounting": {
              "type": "FIXED_ONE_ANGLE",
              "tilt": 39
            }
          }
        },
        "degradation": 0.5,
        "degradationFirstYear": 0.8,
        "module": {
          "technology": "CSI"
        },
        "inverter": {
          "inverterLimitationACPower": 5,
          "startPower": 0.02,
          "inverterEfficiency": {
            "constant": 97.5
          }
        },
        "dcLosses": {
          "overall": 5.4
        },
        "acLosses": {
          "overall": 1.5
        }
      }
    ]
  }
}